{
  "artifact": {
    "id": "merge-decision-attempt-1-prv-4-spec-anthropic-2026-04-20-april-20-2026-2",
    "version": 1,
    "source_stage": "merge",
    "next_stage": "release_staging",
    "status": "approved",
    "risk_tier": "medium",
    "execution_lane": "restricted",
    "owner_agent": "Merge Conductor",
    "policy_decision_id": "policy-anthropic-2026-04-20-april-20-2026-25307862",
    "model_fingerprint": "merge_conductor.v1",
    "budget_class": "large",
    "rollback_class": "manual_recovery_required",
    "approval_requirements": [
      "security",
      "merge",
      "release"
    ],
    "blocking_issues": [],
    "created_at": "2026-04-23T11:13:23Z",
    "updated_at": "2026-04-23T11:13:23Z"
  },
  "spec_packet_id": "spec-anthropic-2026-04-20-april-20-2026-25307862",
  "pr_packet_id": "pr-spec-anthropic-2026-04-20-april-20-2026-25307862",
  "security_review_id": "security-review-attempt-1-prv-3-spec-anthropic-2026-04-20-april-20-2026",
  "build_attempt": 1,
  "evaluated_pr_artifact_version": 4,
  "resulting_pr_artifact_version": 5,
  "merge_plan": {
    "target_branch": "main",
    "method": "merge_commit",
    "autonomy_mode": "human_required",
    "required_approvals": [
      "merge"
    ],
    "approvals_granted": [
      "merge"
    ],
    "pending_approvals": []
  },
  "merge_decision": {
    "status": "merged",
    "mode": "human_approved",
    "approvals_granted": [
      "merge"
    ],
    "pending_approvals": [],
    "rationale": "Merge checks passed and explicit human merge approval was granted.",
    "merged_by": "merge-oncall",
    "merged_at": "2026-04-23T11:13:23Z",
    "merge_commit_sha": "ef0699273226"
  },
  "summary": {
    "blocking_findings": [],
    "watch_findings": [],
    "passed_check_ids": [
      "security_signoff",
      "reviewer_approval",
      "merge_readiness",
      "merge_approval",
      "explicit_merge_blocking_findings",
      "merge_not_already_executed",
      "merge_policy_mode"
    ],
    "failed_check_ids": [],
    "needs_human_review_check_ids": []
  }
}
